Id;VocabularyId;Ordinal;English
343;115;1;The poor student dreaded going to school each morning.
344;115;2;He had a dread feeling about the challenge he was about to face.
345;115;3;I dread going into that deserted house.
346;116;1;The boy became more masculine as he got older.
347;116;2;It is undeniable that his beard makes him look masculine.
348;116;3;The girls liked Jerry because of his masculine ways.
349;117;1;Irv's lack of respect made him a menace to his parents.
350;117;2;The torrents of rain were a menace to the farmer's crops.
351;117;3;Sergeant Foy's raw language was an obvious menace to the reputation of the entire police department.
352;118;1;My algebra teacher has a tendency to forget the students' names.
353;118;2;His tendency was to work hard in the morning and then to take it easy in the afternoon.
354;118;3;The tendency in all human beings is to try to survive.
355;119;1;I admit that I underestimated the power in the bulky fighter's frame.
356;119;2;Undoubtedly the boss underestimated his employee's ability to work hard.
357;119;3;The value of our house was underestimated by at least two thousand dollars.
358;120;1;Playing in New Jersey, the Giants were victorious two years in a row.
359;120;2;Terry faced the challenge with the bad attitude that he could not be victorious.
360;120;3;Our girls' volleyball squad was victorious over a taller team.
361;121;1;Critics review numerous movies every week.
362;121;2;Dr. Fischer had resisted accepting money from the poor woman on numerous house calls.
363;121;3;Critics review numerous movies every week.
364;121;4;Dr. Fischer had resisted accepting money from the poor woman on numerous house calls.
365;121;5;The debator used numerous documents to back up his statements.
366;122;1;The toy was flexible, and the baby could bend it easily.
367;122;2;Remaining flexible, Nick listened to arguments from both sides.
368;122;3;A mouse's flexible body allows it to squeeze through narrow openings.
369;123;1;Each juror felt he needed more evidence before voting to convict the former football star.
370;123;2;Her many awards were evidence enough that Leona excelled in typing.
371;123;3;Our teacher ignored the evidence that Simon had cheated on the test.
372;124;1;Sid's solitary manner kept him from making new friendships.
373;124;2;There was not a solitary piece of evidence that Manuel had eaten the cheesecake.
374;124;3;The convict went into a rage when he was placed in a solitary cell.
375;125;1;With the aid of the binoculars, my vision improved enough to see the entire vicinity
376;125;2;Ted Williams had perfect vision, and that helped to make him a great baseball player.
377;125;3;The glasses that lrma bought corrected her near-sighted vision.
378;126;1;We made frequent visits to the hospital to see our grandfather.
379;126;2;On frequent occasions Sam fell asleep in class.
380;126;3;Dr. Bonner gave me some pills for my frequent headaches.
381;127;1;This morning we caught our first glimpse of the beautiful shoreline.
382;127;2;One glimpse of the very feminine vision was enough to tell Romeo that he loved Juliet.
383;127;3;The tall shrubs kept us from getting a glimpse of the new people who inhabited the beach house.
384;128;1;At a recent meeting, the Board of Education provided the evidence we had been asking for.
385;128;2;Bessie liked the old silent movies better than the more recent ones.
386;128;3;Recent studies have concluded that more people are working than ever before.
387;129;1;After a decade of granting salary increases, my boss ended the practice.
388;129;2;Many people moved out of this city in the last decade.
389;129;3;I have a vision that this decade will be better than the last one.
390;130;1;Nora hesitated to accept the challenge.
391;130;2;When he got to the robbers' vicinity, he hesitated before going on.
392;130;3;The proverb tells us that he who hesitates is lost.
393;131;1;It was absurd to believe the fisherman's tall tale.
394;131;2;The flabby boy realized that the suggestion to diet was not absurd.
395;131;3;Underestimating the importance of reading is absurd.
396;132;1;Our opinions about the company's success in the last decade are in conflict with what the records show.
397;132;2;There was a noisy conflict over who was the better tennis player.
398;132;3;The class mediation team was invited to settle the conflict.
399;133;1;Only a small minority of the neighborhood didn't want a new park.
400;133;2;A minority of our athletes who competed in the Olympics were victorious.
401;133;3;Blacks are a minority group in the United States.
402;134;1;The story that the President had died was fiction.
403;134;2;We hardly ever believed Vinny because what he said was usually fiction.
404;134;3;Marge enjoys reading works of fiction rather than true stories.
405;135;1;Spark plugs ignite in an automobile engine.
406;135;2;One match can ignite an entire forest.
407;135;3;A careless remark helped to ignite the conflict between the brothers and the sisters.
408;136;1;The death penalty has recently been abolished in our state.
409;136;2;We abolished numerous laws which didn't serve any purpose in this decade.
410;136;3;My school has abolished final exams altogether.
411;137;1;Many businesses open offices in urban areas.
412;137;2;I plan to exchange my urban location for a rural one.
413;137;3;Only a small minority of the people of the United States live far from any urban area.
414;138;1;China has the largest population of any country.
415;138;2;The population of the world has increased in every decade.
416;138;3;After the recent floods, the population of Honduras was reduced by 10,000.
417;139;1;Never underestimate the value of being frank with one another.
418;139;2;Eretha was completely frank when she told her friend about the sale.
419;139;3;People liked Duffy because they knew he would be frank with them.
420;140;1;The Atlantic Ocean is in danger of becoming polluted.
421;140;2;There is much evidence to show that the air we breathe is polluted.
422;140;3;It is claimed that soap powders pollute the water we drink.
423;141;1;Napoleon agreed to reveal the information to the French population
424;141;2;The evidence was revealed only after hours of questioning.
425;141;3;General Motors revealed reluctantly that there were defects in their new Buicks.
426;142;1;Elvin's manager prohibited him from appearing on television.
427;142;2;Many homeowners prohibit others from walking on their property.
428;142;3;The law prohibits the use of guns to settle a conflict.
429;143;1;An urgent telephone call was made to the company's treasurer.
430;143;2;The principal called an urgent meeting to solve the school's numerous problems.
431;143;3;When he heard the urgent cry for help, the lifeguard did not hesitate.
432;144;1;Rover was given an adequate amount of food to last him the whole lesson.
433;144;2;A bedroom, kitchen, and bath were adequate shelter for his living needs.
434;144;3;Carlos was adequate at his job but he wasn't great.
435;145;1;As he kept spending money, the amount he had saved decreased.
436;145;2;In order to improve business, the store owner decreased his prices.
437;145;3;The landlord promised to decrease our rent.
438;146;1;From across the room, the teacher's voice was barely audible.
439;146;2;After Len got his new hearing aid, my telephone calls became audible.
440;146;3;Commands from Ann's drill sergeant were always easily audible.
441;147;1;There were four journalists covering the murder story.
442;147;2;Barbara's experience working at a book store wasn't adequate preparation for becoming a journalist.
443;147;3;A journalist must have a comprehensive knowledge of the city where he or she works.
444;148;1;Famine in India caused the death of one-tenth of the population.
445;148;2;There has been a famine of good writing in the last decade.
446;148;3;The rumor of a famine in Europe was purely fiction.
447;149;1;There is a movement to revive old plays for modern audiences.
448;149;2;The nurses tried to revive the heart attack victim.
449;149;3;Committees are trying to revive interest in population control.
450;150;1;Graduation will commence at ten o'clock.
451;150;2;Bella hesitated before commencing her speech.
452;150;3;The discussion commenced with a report on urban affairs.
453;151;1;We were observant of the conflict between the husband and his wife.
454;151;2;Because Cato was observant, he was able to reveal the thief's name.
455;151;3;Milt used his excellent vision to be observant of everything in his vicinity.
456;152;1;Numerous witnesses identified the butcher as the thief.
457;152;2;Mrs. Shaw was able to identify the painting as being hers.
458;152;3;With only a quick glimpse, Reggie was able to identify his girlfriend in the crowd.
459;153;1;The fruit pickers migrated to wherever they could find work.
460;153;2;Much of our population is constantly migrating to other areas of the country.
461;153;3;My grandfather migrated to New York from Italy in 1919.
462;154;1;The Girl Scouts were permitted a glimpse of the vessel being built when they toured the Navy Yard.
463;154;2;My father burst a blood vessel when he got the bill from the garage.
464;154;3;Congress voted to decrease the amount of money being spent on space vessels.
465;155;1;The humid weather persisted all summer.
466;155;2;Would Lorraine's weird behavior persist, we all wondered?
467;155;3;L10yd persisted in exaggerating everything he said.
468;156;1;The vicinity of London is known to be hazy.
469;156;2;Factories that pollute the air create hazy weather conditions.
470;156;3;Although Cora had a great memory, she was unusually hazy about the details of our meeting on January 16th.
471;157;1;A gleam of light shone through the prison window.
472;157;2;The only source of light in the cellar came in the form of a gleam through a hole in the wall.
473;157;3;My grandmother gets a gleam in her eyes when she sees the twins.
474;158;1;The student was proud to be the editor of the school newspaper.
475;158;2;Meredith's journalistic knowledge came in handy when he was unexpectedly given the job of editor of The Bulletin.
476;158;3;It is undeniable that the magazine has gotten better since Ellis became editor.
477;159;1;Unruly behavior is prohibited at the pool.
478;159;2;When he persisted in acting unruly, Ralph was fired from his job.
479;159;3;His unruly actions were a menace to those who were trying to work.
480;160;1;The boxer devised an attack which would help him to be victorious over his young rival.
481;160;2;Sherry didn't like to compete because she always thought her rival would win.
482;160;3;Seidman and Son decided to migrate to an area where they would have fewer rivals.
483;161;1;Carefully, very carefully, we approached the violent man.
484;161;2;Violent behavior is prohibited on school grounds.
485;161;3;Vernon had a tendency to be violent when someone angered him.
486;162;1;Dozens of employees quit the job because the boss was brutal to them.
487;162;2;The brutal track coach persisted in making the team work out all morning under the hot sun.
488;162;3;Swearing to catch the murderer, the detectives revealed that it had been an unusually brutal, violent crime.
489;163;1;The Russian chess player underestimated his opponent and lost.
490;163;2;He was a bitter opponent of costly urban reform.
491;163;3;Seeing his flabby opponent, Slugger was sure he would be victorious.
492;164;1;The journalist covered all the details of the brawl in the park.
493;164;2;Larry dreaded a brawl with his father over finding a job.
494;164;3;What started out as a polite discussion soon became a violent brawl.
495;165;1;Elliott tried to deceive Mrs. Held by making a duplicate of my paper.
496;165;2;We duplicated the document so that everyone had a copy to study.
497;165;3;The so-called expert did a mediocre job of duplicating the Van Gogh painting.
498;166;1;Liza was unpopular because she was vicious to people she had just met.
499;166;2;The vicious editor published false stories about people he disliked.
500;166;3;Mr. Voss was reluctant to talk about his vicious pit bull.
501;167;1;The space vessel was whirling around before it landed on earth.
502;167;2;As they tried to lift the bulky piano, the movers went whirling across the living room.
503;167;3;Because Angelo drank too much, he commenced to feel that everything was whirling around the bar.
504;168;1;Minority groups complain about being the underdogs in this century.
505;168;2;I always feel sorry for the underdog in a street fight.
506;168;3;The Jets were identified as underdogs even though they had beaten the Los Angeles Rams earlier in the season.
507;169;1;Once the jet engine was ignited, it thrust the rocket from the ground.
508;169;2;He had adequate strength to thrust himself through the locked door.
509;169;3;Eva was in a terrible rage when she thrust herself into the room.
510;170;1;The lawyer was bewildered by his client's lack of interest in the case.
511;170;2;His partner's weird actions left Jack bewildered.
512;170;3;Bewildered by the sudden hazy weather, he decided not to go to the beach.
513;171;1;We will expand our business as soon as we locate a new building.
514;171;2;Present laws against people who pollute the air must be expanded.
515;171;3;Expanding the comic strips, the editor hoped that more people would buy his paper.
516;172;1;I altered my typical lunch and had a steak instead.
517;172;2;Dorothy agreed to alter my dress if I would reveal its cost to her.
518;172;3;It's absurd to spend money to alter that old candy store.
519;173;1;I could tell that Mitch was mature from the way he persisted in his work.
520;173;2;Only through mature study habits can a person hope to gain knowledge.
521;173;3;It is essential that you behave in a mature way in the business world.
522;174;1;Her sacred medal had to be sold because the family was in urgent need of money.
523;174;2;It was revealed by the journalist that the sacred temple had been torn down.
524;174;3;Kate made a sacred promise to her parents never to miss a Sunday church service.
525;175;1;My family revised its weekend plans when the weather turned hazy.
526;175;2;The dictionary was revised and then published in a more expensive edition.
527;175;3;Under the revised rules, Shane was eliminated from competing.
528;176;1;Before the grand jury, the sinister gangster pledged to tell the whole truth.
529;176;2;Monte was reluctant to pledge his loyalty to his new girlfriend.
530;176;3;Pledged to discovering the facts, the journalist began to dig up new evidence for his readers.
531;177;1;As the villain stole the money from the blind man, he walked away in a casual manner.
532;177;2;The bartender made a casual remark about the brawl in the backroom.
533;177;3;Following a casual meeting on the street, the bachelor renewed his friendship with the widow.
534;178;1;We pursued the bicycle thief until he vanished from our vision.
535;178;2;Ernie rowed up the river, pursuing it to its source.
536;178;3;The senior wanted to pursue urban affairs as his life's work.
537;179;1;The class was unanimous in wanting to eliminate study halls.
538;179;2;There has never been an election in our union which was won by a unanimous vote.
539;179;3;The Senate, by a unanimous vote, decided to decrease taxes.
540;180;1;Wesley was fortunate to have an adequate sum of money in the bank.
541;180;2;It is fortunate that the famine did not affect our village.
542;180;3;The underdog was fortunate enough to come out a winner.
543;181;1;My grandfather was a pioneer in selling wholesale products.
544;181;2;England was a pioneer in building large vessels for tourists.
545;181;3;In the fourth grade I assembled a picture collection of great American pioneers.
546;182;1;The innovative ads for the candy won many new customers.
547;182;2;Everyone in our office praised the boss for his innovative suggestions.
548;182;3;Nicole decided to alter her approach and become more innovative.
549;183;1;Carlotta's slender figure made her look somewhat taller than she was.
550;183;2;There was only a slender chance that you could conceal the truth.
551;183;3;The slender thief was able to enter the apartment through the narrow window.
552;184;1;The machines of the twentieth century surely surpass those of earlier times.
553;184;2;Most farmers believe that rural life far surpasses urban living.
554;184;3;It is undeniable that a cold lemonade in July cannot be surpassed.
555;185;1;Daniel Boone explored vast areas that had never been settled.
556;185;2;Our campus always seems vast to new students.
557;185;3;Vast differences between the two sides were made clear in the debate.
558;186;1;Scientists doubt that a total cure for cancer will be found soon.
559;186;2;The question of whether he could survive the winter was left in doubt.
560;186;3;We don't doubt that the tradition of marriage will continue.
561;187;1;A sign in the elevator stated that its capacity was 1100 pounds.
562;187;2;The gasoline capsule had a capacity of 500 gallons.
563;187;3;So well-liked was the prominent speaker that the auditorium was filled to capacity when he began his lecture.
564;188;1;We had to penetrate the massive wall in order to hang the mirror.
565;188;2;Although Kenny tried to pound the nail into the rock with a hammer, he couldn't penetrate the hard surface.
566;188;3;The thieves penetrated the banks security and stole the money.
567;189;1;My sister is debating whether or not to get her ears pierced.
568;189;2;I tried to ignore his bad violin playing, but the sound was piercing.
569;189;3;Halloran violently pierced the skin of his rival, causing massive bleeding.
570;190;1;Ushers took an accurate count of the people assembled in the theatre.
571;190;2;Emma's vision was so accurate that she didn't need glasses.
572;190;3;In writing on the topic, Vergil used accurate information.
573;191;1;The students used a microscope to see the miniature insect.
574;191;2;When Young Oprah's birthday came around, her uncle gave her a microscope.
575;191;3;Using a microscope, the scientist was able to probe into the habits of germs.
576;192;1;The majority of pupils felt grateful for Mr. Ash's help.
577;192;2;We were grateful that the gloomy weather cleared up on Saturday.
578;192;3;In his letter, Waldo told how grateful he was for the loan.
579;193;1;Be cautious when you choose your opponent.
580;193;2;Good authors are cautious not to exaggerate when they write.
581;193;3;If the rain is falling in torrents, it is best to drive cautiously.
582;194;1;Judge Emery was confident he could solve the conflict.
583;194;2;When he lifted the burden, Scotty was confident he could carry it.
584;194;3;Annette was confident she would do well as a nurse.
585;195;1;Anything Jorge could get at wholesale price had a great appeal for him.
586;195;2;My boss always appeals to his employees to work swiftly and neatly.
587;195;3;I found her clothing designs to be enormously appealing.
588;196;1;Because he was a heroin addict, it was essential for Carlos to get the drug each lesson.
589;196;2;Marcia became flabby because she was addicted to ice cream sodas.
590;196;3;Those who take aspirins and other pain-killers regularly should realize that they may become drug addicts, too.
591;197;1;Marilyn's mother told her to be wary of strangers with a gleam in their eye.
592;197;2;After Orlando had been the victim of a cheat, he was wary of those who said they wanted to help him.
593;197;3;Living in a polluted city makes you wary of the air you breathe.
594;198;1;Donna was aware of her tendency to exaggerate.
595;198;2;It was some time before the police became aware of the brawl which was taking place on the street.
596;198;3;The only way to gain knowledge is to be aware of everything around you.
597;199;1;It was my misfortune that our car wasn't thoroughly checked before the trip through the desert.
598;199;2;Being bitten by the vicious dog was quite a misfortune for Tommy.
599;199;3;I had the misfortune of working for a greedy man.
600;200;1;If you are fortunate, you can avoid people who are trying to deceive you.
601;200;2;There was no way to avoid noticing her beautiful green eyes.
602;200;3;Avoid getting into a brawl if you can.
603;201;1;I feel wretched after a night when I've scarcely slept.
604;201;2;There was unanimous agreement that we had seen a wretched movie.
605;201;3;Toby had wretched luck at the gambling tables.
606;202;1;The corner saloon uses numerous kegs of beer on a Saturday night.
607;202;2;Get a keg of nails, the carpenter shouted at me,
608;202;3;It is obvious to me that the situation is filled with peril, a real powder keg if I ever saw one.
609;203;1;A diet of nourishing food is served to every hospital patient.
610;203;2;It was easy to detect that the skinny boy was not well nourished.
611;203;3;After the operation, our doctor plans to nourish my mother with vitamins and good food.
612;204;1;The law is harsh on people who go around menacing others.
613;204;2;Looking at his cigarette, Phil realized it was absurd to inhale such harsh smoke.
614;204;3;Hazel altered her tone of voice from a harsh one to a soft tone.
615;205;1;I never neglect to carry a small quantity of money with me.
616;205;2;Who believes that quantity is better than quality?
617;205;3;A large quantity of meat is always stored in our freezer.
618;206;1;If you give me an ice cream choice, I'll opt for chocolate.
619;206;2;Our cheerleaders plan to opt for new sweaters.
620;206;3;On Friday, three of my buddies will opt to go into the navy.
621;207;1;It was a tragedy that some pioneers were killed on their way west.
622;207;2;If you had your choice between seeing a comedy or a tragedy, which play would you choose?
623;207;3;Harry's enormous jealousy led to the tragedy in their family.
624;208;1;After driving a bus all lesson, Norris liked to be a pedestrian and take long, casual walks in the evening.
625;208;2;The police say it is urgent that pedestrians stay on the sidewalk.
626;208;3;I don't doubt that a pedestrian can get places faster than a car in downtown traffic.
627;209;1;The observant driver glanced at the accident at the side of the road.
628;209;2;I took one glance at the wretched animal and turned away.
629;209;3;Thompson identified the burglar after a glance at the photograph in the police station.
630;210;1;We had to decrease the budget this year because our club is broke.
631;210;2;The prominent executive presented her budget to the Board of Directors.
632;210;3;When my mother draws up her budget for the week, she sets aside a goodly sum for nourishing food.
633;211;1;Although Dusty was a miniature poodle, he was nimble enough to fight bigger dogs.
634;211;2;The nimble policeman leaped over the fence to pursue the car thief.
635;211;3;At his press conference, the commissioner was quite nimble in avoiding the difficult questions.
636;212;1;Scientists must know how to manipulate their microscopes.
637;212;2;While Mr. Baird manipulated the puppets, Fran spoke to the audience.
638;212;3;The wounded pilot manipulated the radio dial until he made contact.
639;213;1;"We must not ignore reckless drivers; we must take them off the road."
640;213;2;After breaking his hand fighting recklessly, Arthur decided to be more cautious in the future.
641;213;3;The reckless smoker ignited the entire forest.
642;214;1;Janey avoided staring at the horrid man's face.
643;214;2;It is simply horrid the way cars pollute the air we breathe.
644;214;3;When Mary was good, she was very good, but when she was bad, she was horrid.
645;215;1;Shortly after taking the drug, the addict began to rave and foam at the mouth.
646;215;2;Speedy raved that his car had the capacity to reach 120 miles per hour.
647;215;3;Sadie was confident that Mr. Stebbe would rave about her essay.
648;216;1;I find it economical to shop in the large supermarkets.
649;216;2;Marissa was praised for her economical management of the budget.
650;216;3;The President made Congress aware of the need to be more economical.
651;217;1;The bulky wheels of a railroad train must be lubricated each week.
652;217;2;A large quantity of grease is needed to lubricate an airplane engine.
653;217;3;When a watch is lubricated, it keeps more accurate time.
654;218;1;Bernie devised an ingenious plan to cheat on his income tax.
655;218;2;Rube Goldberg was a journalist who won fame for his ingenious inventions.
656;218;3;The master spy had an ingenious way of passing secrets to the agent.
657;219;1;This year's harvest was adequate to feed all our people.
658;219;2;The farmer decided to expand his fields so that he would get a bigger harvest.
659;219;3;If the harvest is poor, there is always the possibility of a famine.
660;220;1;It is urgent that the hospital have an abundant supply of blood.
661;220;2;An abundant harvest was predicted by the Secretary of Agriculture.
662;220;3;In recent years an abundant number of complaints have disturbed the telephone company.
663;221;1;Mrs. Spinner was uneasy about letting her son play in the vicinity of the railroad tracks.
664;221;2;The treasurer was uneasy about the company's budget
665;221;3;Arnold felt uneasy about the meeting even though he tried to act in a casual manner.
666;222;1;The cook had to calculate the number of diners to see whether he could decrease his order for meat.
667;222;2;In order to see how expensive the car was, the buyer calculated the tax and other charges.
