Id;VocabularyId;Ordinal;English
1;1;1;When Roy abandoned his family, the police went looking for him.
2;1;2;The soldier could not abandon his friends who were hurt in battle.
3;1;3;Because Rose was poor, she had to abandon her idea of going to college.
4;2;1;The butcher's keen knife cut through the meat.
5;2;2;My dog has a keen sense of smell.
6;2;3;Bill's keen mind pleased all his teachers.
7;3;1;A detective was hired by the jealous widow to find the boyfriend who had abandoned her.
8;3;2;Although my neighbor just bought a new car, I am not jealous of him.
9;3;3;Being jealous, Mona would not let her boyfriend dance with any of the cheerleaders.
10;4;1;My aunt never hurts anyone's feelings because she always uses tact.
11;4;2;By the use of tact, Janet was able to calm her jealous husband.
12;4;3;Your friends will admire you if you use tact and thoughtfulness.
13;5;1;The President will take the oath of office tomorrow.
14;5;2;In court, the witness took an oath that he would tell the whole truth.
15;5;3;When Terry discovered that he had been abandoned, he let out an angry oath.
16;6;1;Someone is planning to build a house on that vacant lot.
17;6;2;I put my coat on that vacant seat.
18;6;3;When the landlord broke in, he found that apartment vacant.
19;7;1;The fighter had to face many hardships before he became champion.
20;7;2;Abe Lincoln was able to overcome one hardship after another.
21;7;3;On account of hardship, Bert was let out of the army to take care of his sick mother.
22;8;1;The pilot swore a gallant oath to save his buddy.
23;8;2;Many gallant knights entered the contest to win the princess.
24;8;3;Ed is so gallant that he always gives up his subway seat to a woman.
25;9;1;The data about the bank robbery were given to the F.B.I.
26;9;2;After studying the data, we were able to finish our report.
27;9;3;Unless you are given all the data, you cannot do the math problem.
28;10;1;Coming from Alaska, Claude was unaccustomed to Florida's heat.
29;10;2;The king was unaccustomed to having people disobey him.
30;10;3;Unaccustomed as he was to exercise, Vic quickly became tired.
31;11;1;My brother took an oath to remain a bachelor.
32;11;2;In the movie, the married man was mistaken for a bachelor.
33;11;3;Before the wedding, all his bachelor friends had a party.
34;12;1;I am trying to qualify for the job which is now vacant.
35;12;2;Since Pauline can't carry a tune, she is sure that she will never qualify for the Girls' Chorus.
36;12;3;"You have to be over 5'5"" to qualify as a policeman in our town."
37;13;1;When given all the data on the corpse, Columbo was able to solve the murder.
38;13;2;The corpse was laid to rest in the vacant coffin.
39;13;3;An oath of revenge was sworn over the corpse by his relatives.
40;14;1;Tris could not conceal his love for Gloria.
41;14;2;Count Dracula concealed the corpse in his castle.
42;14;3;The money was so cleverly concealed that we were forced to abandon our search for it.
43;15;1;When the weather is so dismal, I sometimes stay in bed all lesson.
44;15;2;I am unaccustomed to this dismal climate.
45;15;3;As the dismal reports of the election came in, the senator's friends tactfully made no mention of them.
46;16;1;It was a great hardship for the men to live through the frigid winter at Valley Forge.
47;16;2;The jealous bachelor was treated in a frigid manner by his girlfriend
48;16;3;Inside the butcher's freezer the temperature was frigid.
49;17;1;Eskimos inhabit the frigid part of Alaska.
50;17;2;Because Sidney qualified, he was allowed to inhabit the vacant apartment.
51;17;3;Many crimes are committed each year against those who inhabit the slum area of our city.
52;18;1;My fingers quickly became numb in the frigid room.
53;18;2;A numb feeling came over Mr. Massey as he read the telegram.
54;18;3;When the nurse stuck a pin in my numb leg, I felt nothing.
55;19;1;The hunter was abandoned by the natives when he described the peril which lay ahead of them.
56;19;2;There is great peril in trying to climb the mountain.
57;19;3;Our library is filled with stories of perilous adventures.
58;20;1;Richard likes to recline in front of the television set.
59;20;2;After reclining on her right arm for an hour, Maxine found that it had become numb.
60;20;3;My dog's greatest pleasure is to recline by the warm fireplace.
61;21;1;The maid shrieked when she discovered the corpse.
62;21;2;With a loud shriek, Ronald fled from the room.
63;21;3;Facing the peril of the waterfall, the boatman let out a terrible shriek.
64;22;1;The sinister plot to cheat the widow was uncovered by the police.
65;22;2;When the bank guard spied the sinister-looking customer, he drew his gun.
66;22;3;I was frightened by the sinister shadow at the bottom of the stairs.
67;23;1;A banana split can tempt me to break my diet.
68;23;2;The sight of beautiful Louise tempted the bachelor to change his mind about marriage.
69;23;3;Your offer of a job tempts me greatly.
70;24;1;I lost a small wager on the Superbowl.
71;24;2;After winning the wager, Tex treated everyone to free drinks.
72;24;3;It is legal to make a wager in the state of Nevada.
73;25;1;The sinister character in the movie wore a typical costume, a dark shirt, loud tie, and tight jacket.
74;25;2;The horse ran its typical race, a slow start and a slower finish, and my uncle lost his wager.
75;25;3;It was typical of the latecomer to conceal the real cause of his lateness.
76;26;1;Studies show that adults need a minimum of six hours sleep.
77;26;2;The minimum charge for a telephone, even if no calls are made, is about nine dollars a month.
78;26;3;Congress has set a minimum wage for all workers.
79;27;1;Chairs which are older than one hundred years are scarce.
80;27;2;Because there is little moisture in the desert, trees are scarce.
81;27;3;How scarce are good cooks?
82;28;1;The annual convention of musicians takes place in Hollywood.
83;28;2;The publishers of the encyclopedia put out a book each year called an annual.
84;28;3;Plants that live only one year are called annuals.
85;29;1;Can you persuade him to give up his bachelor days and get married?
86;29;2;No one could persuade the captain to leave the sinking ship.
87;29;3;Beth's shriek persuaded Jesse that she was in real danger.
88;30;1;The essential items in the cake are flour, sugar, and shortening.
89;30;2;It is essential that we follow the road map.
90;30;3;Several layers of thin clothing are essential to keeping warm in frigid climates.
91;31;1;The colors of the rainbow blend into one another.
92;31;2;A careful blend of fine products will result in delicious food.
93;31;3;When Jose blends the potatoes together, they come out very smooth.
94;32;1;The ship was barely visible through the dense fog.
95;32;2;Before the stars are visible, the sky has to become quite dark.
96;32;3;You need a powerful lens to make some germs visible.
97;33;1;Because diamonds are scarce they are expensive.
98;33;2;Margarine is much less expensive than butter.
99;33;3;Shirley's expensive dress created a great deal of excitement at the party.
100;34;1;Medori's talent was noted when she was in first grade.
101;34;2;Feeling that he had the essential talent, Carlos tried out for the school play.
102;34;3;Hard work can often make up for a lack of talent.
103;35;1;The burglars devised a scheme for entering the bank at night.
104;35;2;I would like to devise a method for keeping my toes from becoming numb while I am ice skating.
105;35;3;If we could devise a plan for using the abandoned building, we could save thousands of dollars.
106;36;1;The wholesale price of milk is six cents a quart lower than retail.
107;36;2;Many people were angered by the wholesale slaughter of birds.
108;36;3;By buying my ties wholesale I save fifteen dollars a year.
109;37;1;Scientists have devised methods for trapping vapor in bottles so they can study its make-up.
110;37;2;He has gathered data on the amount of vapor rising from the swamp.
111;37;3;A vapor trail is the visible stream of moisture left by the engines of a jet flying at high altitudes.
112;38;1;When the railroad tracks are raised, the danger of crossing will be eliminated.
113;38;2;When figuring the cost of a car, don't eliminate such extras as air conditioning.
114;38;3;If we were to eliminate all reclining chairs, no one would fall asleep while watching television.
115;39;1;A typical moving picture villain gets killed at the end.
116;39;2;The villain concealed the corpse in the cellar.
117;39;3;When the villain fell down the well, everyone lived happily ever after.
118;40;1;The dense leaves on the trees let in a minimum of sunlight.
119;40;2;We couldn't row because of the dense weeds in the lake.
120;40;3;His keen knife cut through the dense jungle.
121;41;1;No one seems willing to utilize this vacant house.
122;41;2;The gardener was eager to utilize different flowers and blend them in order to beautify the borders.
123;41;3;Does your mother utilize leftovers in her cooking?
124;42;1;It was so humid in our classroom that we wished the school would buy an air conditioner.
125;42;2;New Yorkers usually complain in the summer of the humid air.
126;42;3;Most people believe that ocean air is quite humid.
127;43;1;Einstein's theory is really too difficult for the average person to understand.
128;43;2;My uncle has a theory about the effect of weather on baseball batters.
129;43;3;No one has advanced a theory explaining the beginnings of writing.
130;44;1;If we let the air out of a balloon, it will have to descend.
131;44;2;The pilot, thinking his plane was in peril, descended quickly.
132;44;3;Knowing her beau was waiting at the bottom of the staircase, Eleanor descended at once.
133;45;1;A fan may circulate the air in summer, but it doesn't cool it.
134;45;2;My father circulated among the guests at the party and made them feel comfortable.
135;45;3;Hot water circulates through the pipes in the building, keeping the room warm.
136;46;1;The enormous crab moved across the ocean floor in search of food.
137;46;2;Public hangings once drew enormous crowds.
138;46;3;The gallant knight drew his sword and killed the enormous dragon.
139;47;1;Weathermen can predict the weather correctly most of the time.
140;47;2;Who can predict the winner of the Superbowl this year?
141;47;3;Laura thought she could predict what I would do, but she was wrong.
142;48;1;Even in California the sun will sometimes vanish behind a cloud.
143;48;2;Not even a powerful witch can make a jealous lover vanish.
144;48;3;Give him a week without a job and all his money will vanish.
145;49;1;The father tried to persuade his son that the tradition of marriage was important.
146;49;2;All religions have different beliefs and traditions.
147;49;3;As time goes on, we will eliminate traditions which are meaningless.
148;50;1;Tomatoes are less expensive at the rural farm stand.
149;50;2;Rural areas are not densely populated.
150;50;3;The rural life is much more peaceful than the city one.
151;51;1;The burden of the country's safety is in the hands of the President.
152;51;2;Irma found the enormous box too much of a burden.
153;51;3;Ricky carried the burden throughout his college career.
154;52;1;The campus was designed to utilize all of the college's buildings.
155;52;2;Jeff moved off campus when he decided it was cheaper to live at home.
156;52;3;I chose to go to Penn State because it has a beautiful campus.
157;53;1;A majority of votes was needed for the bill to pass.
158;53;2;The majority of people prefer to pay wholesale prices for meat.
159;53;3;In some countries, the government does not speak for the majority of the people.
160;54;1;The rioters assembled outside the White House.
161;54;2;I am going to assemble a model of a spacecraft.
162;54;3;All the people who had assembled for the picnic vanished when the rain began to fall.
163;55;1;Lawyer Spence explored the essential reasons for the crime.
164;55;2;The Weather Bureau explored the effects of the rainy weather.
165;55;3;Sara wanted to know if all of the methods for solving the problem had been explored.
166;56;1;Predicting the weather is our favorite topic of conversation.
167;56;2;Valerie only discussed topics that she knew well.
168;56;3;The speaker's main topic was how to eliminate hunger in this world.
169;57;1;The debate between the two candidates was heated.
170;57;2;Debate in the U.S. Senate lasted for five days.
171;57;3;Instead of shrieking at each other, the students decided to have a debate on the topic.
172;58;1;Juan tried to evade the topic by changing the subject.
173;58;2;In order to evade the police dragnet, Ernie grew a beard.
174;58;3;The prisoner of war evaded questioning by pretending to be sick.
175;59;1;The lawyer probed the man's mind to see if he was innocent.
176;59;2;After probing the scientist's theory, we proved it was correct.
177;59;3;King Henry's actions were carefully probed by the noblemen.
178;60;1;After the prison riot, the council decided to reform the correctional system.
179;60;2;Brad reformed when he saw that breaking the law was hurting people other than himself.
180;60;3;Only laws that force companies to reform will clear the dangerous vapors from our air.
181;61;1;The lawyers in the Simpson trial were often asked to approach the bench.
182;61;2;Her beau kissed Sylvia when he approached her.
183;61;3;Ben approached the burden of getting a job with a new spirit.
184;62;1;Sam Spade detected that the important papers had vanished.
185;62;2;From her voice it was easy to detect that Ellen was frightened.
186;62;3;We detected from the messy room that a large group of people had assembled there.
187;63;1;Call me tomorrow evening if possible.
188;63;2;It is now possible for man to walk on the moon.
189;63;3;Considering Melissa's weakness in writing, it is not possible for her to help you with your composition.
190;64;1;It is not possible to compel a person to love his fellow man.
191;64;2;Heavy floods compelled us to stop.
192;64;3;Mr. Gorlin is a teacher who does not have to compel me to behave.
193;65;1;My Chevrolet was sent back to the factory because of a steering defect.
194;65;2;His theory of the formation of our world was filled with defects.
195;65;3;The villain was caught because his plan had many defects.
196;66;1;The employees went on strike for higher wages.
197;66;2;My boss had to fire many employees when meat became scarce.
198;66;3;Joey wanted to go into business for himself and stop being an employee.
199;67;1;The senator neglected to make his annual report to Congress.
200;67;2;Bob's car got dirty when he neglected to keep it polished.
201;67;3;It is essential that you do not neglect your homework.
202;68;1;Atlas was deceived about the burden he had to carry.
203;68;2;Virginia cried when she learned that her best friend had deceived her.
204;68;3;The villain deceived Chief White Cloud by pretending to be his friend.
205;69;1;Ray's team undoubtedly had the best debators in our county.
206;69;2;The pilgrims undoubtedly assembled to travel to Rome together.
207;69;3;If she didn't want to get into an argument, Valerie would have followed the majority undoubtedly.
208;70;1;The Beatles wrote many popular songs.
209;70;2;At one time mini-skirts were very popular.
210;70;3;Popular people often find it hard to evade their many friends.
211;71;1;The police made a thorough search of the house after the crime had been reported.
212;71;2;My science teacher praised Sandy for doing a thorough job of cleaning up the lab.
213;71;3;Mom decided to spend the lesson in giving the basement a thorough cleaning.
214;72;1;The lawyer told her client that she could predict the outcome of his trial.
215;72;2;My uncle tried to get General Motors to be a client of his company.
216;72;3;If this restaurant doesn't improve its service, all its clients will vanish.
217;73;1;After a comprehensive exam, my doctor said I was in good condition.
218;73;2;The engineer gave our house a thorough, comprehensive check-up before my father bought it.
219;73;3;Mrs. Silver wanted us to do a comprehensive study of Edgar Allan Poe.
220;74;1;My aunt saved thousands of dollars by defrauding the government.
221;74;2;If we could eliminate losses from people who defraud the government, tax rates could be lowered.
222;74;3;By defrauding his friend, Dexter ruined a family tradition of honesty.
223;75;1;The young couple wanted to postpone their wedding until they were sure they could handle the burdens of marriage.
224;75;2;I neglected to postpone the party because I thought everyone would be able to come.
225;75;3;The supermarket's owner planned to postpone the grand opening until Saturday.
226;76;1;My teacher consented to let our class leave early.
227;76;2;David would not consent to our plan.
228;76;3;The majority of our club members consented to raise the dues.
229;77;1;The boss asked some employees to lift the massive box.
230;77;2;From lifting weights, Willie had developed massive arm muscles.
231;77;3;The main building on the campus was so massive that the new students had trouble finding their way around at first.
232;78;1;The small capsule contained notes the spy had written after the meeting.
233;78;2;A new, untested medicine was detected in the capsule by the police scientists.
234;78;3;He explored the space capsule for special equipment.
235;79;1;The lawyers wanted to preserve the newest reforms in the law.
236;79;2;Farmers feel that their rural homes should be preserved.
237;79;3;Records of Hank Aaron's home runs will undoubtedly be preserved in the Baseball Hall of Fame.
238;80;1;The father denounced his son for lying to the district attorney.
239;80;2;Some people denounce the government for probing into their private lives.
240;80;3;Ralph Nader, the consumer advocate, denounced the defective products being sold.
241;81;1;Going to Africa was a unique experience for us.
242;81;2;The inventor developed a unique method of making ice cream.
243;81;3;Albie has a unique collection of Israeli stamps.
244;82;1;A massive rain was coming down in torrents.
245;82;2;In the debate, a torrent of questions was asked.
246;82;3;After trying to defraud the public, Lefty was faced with a torrent of charges.
247;83;1;Bertha resented the way her boyfriend treated her.
248;83;2;The earthquake victim resented the poor emergency care.
249;83;3;Columbus resented the fact that his crew wanted to turn back.
250;84;1;My neighbor was molested when walking home from the subway.
251;84;2;The gang did a thorough job of molesting the people in the park.
252;84;3;Lifeguards warned the man not to molest any of the swimmers.
253;85;1;My cousin was gloomy because his best friend had moved away.
254;85;2;The reason Doris wasn't popular was that she always had a gloomy appearance.
255;85;3;Jones Beach is not so beautiful on a gloomy lesson.
256;86;1;We had some unforeseen problems with the new engine.
257;86;2;The probe into the Congressman's finances turned up some unforeseen difficulties.
258;86;3;The divers faced unforeseen trouble in their search for the wreck.
259;87;1;"He wasn't trying to deceive you when he said that his was the best car in the world; he was just exaggerating."
260;87;2;The bookkeeper exaggerated her importance to the company.
261;87;3;When he said that Shaquille O'Neal was eight feet tall, he was undoubtedly exaggerating.
262;88;1;The amateur cross-country runner wanted to be in the Olympics.
263;88;2;After his song, Don was told that he wasn't good enough to be anything but an amateur.
264;88;3;Professional golfers resent amateurs who think they are as good as the people who play for money.
265;89;1;After reading my composition, Mrs. Evans remarked that it was mediocre and that I could do better.
266;89;2;Howard was a mediocre scientist who never made any unique discoveries.
267;89;3;"The movie wasn't a great one; it was only mediocre."
268;90;1;Eldorado Restaurant serves a wide variety of foods.
269;90;2;The show featured a variety of entertainment.
270;90;3;He faced unforeseen problems for a variety of reasons.
271;91;1;The witness neglected to give valid answers to the judge's questions.
272;91;2;Rita had valid reasons for denouncing her father's way of life.
273;91;3;When Dave presented valid working papers, the foreman consented to hiring him immediately.
274;92;1;It was uncertain whether we would survive the torrent of rain.
275;92;2;Some people believe that only the strongest should survive.
276;92;3;The space capsule was built to survive a long journey in space.
277;93;1;She looked weird with that horrible make-up on her face.
278;93;2;Alien felt that weird things were starting to happen when he entered the haunted house.
279;93;3;Becky had a weird feeling after swallowing the pills.
280;94;1;My client is a prominent businessperson.
281;94;2;Napoleon is a prominent figure in the history of France.
282;94;3;Her violet eyes were the prominent feature of the model's face.
283;95;1;Our janitor likes the security of having all doors locked at night.
284;95;2;When the President travels, strict security measures are taken.
285;95;3;Pablo wanted to preserve the security of his life style.
286;96;1;Charley and Morty removed the bulky package from the car.
287;96;2;The massive desk was quite bulky and impossible to carry.
288;96;3;His client wanted an item that wasn't so bulky, Olsen told us.
289;97;1;It was easy to see that Herman was reluctant to go out and find a job.
290;97;2;The patient was reluctant to tell the nurse the whole gloomy truth.
291;97;3;I was reluctant to give up the security of family life.
292;98;1;It was obvious that the lumberjack was tired after his lesson's work.
293;98;2;The fact that Darcy was a popular boy was obvious to all.
294;98;3;The detective missed the clue because it was too obvious.
295;99;1;Living in the vicinity of New York, Jeremy was near many museums.
296;99;2;The torrent of rain fell only in our vicinity.
297;99;3;We approached the Baltimore vicinity by car.
298;100;1;George Washington lived in the eighteenth century.
299;100;2;The United States is more than two centuries old.
300;100;3;Many prominent men have been born in this century.
301;101;1;Joan's bad manners sent her mother into a rage.
302;101;2;In a fit of rage, Francine broke the valuable glass.
303;101;3;The mayor felt a sense of rage about the exaggerations in the press.
304;102;1;Newly discovered documents showed that the prisoner was obviously innocent.
305;102;2;The documents of ancient Rome have survived many centuries.
306;102;3;We were reluctant to destroy important documents.
307;103;1;Most people are happy when they conclude their work for the lesson.
308;103;2;The gloomy lesson concluded with a thunderstorm.
309;103;3;Work on the building could not be concluded until the contract was signed
310;104;1;The jury concluded that the teenagers were undeniably guilty.
311;104;2;It is undeniable that most professionals can beat any amateur.
312;104;3;That Leon resented Rita's good marks in school was undeniable.
313;105;1;Totie could not resist eating the chocolate sundae.
314;105;2;Tight security measures resisted Jimmy's entrance into the bank.
315;105;3;Harold resisted the opportunity to poke fun at the weird man.
316;106;1;Your daily diet should not lack fruits and vegetables.
317;106;2;His problem was that he lacked a variety of talents.
318;106;3;As an amateur dancer, Vincent knew that he lacked the professional touch.
319;107;1;Little Alice realized that if she didn't behave, her parents would ignore her.
320;107;2;The student could not answer the question because he ignored the obvious facts.
321;107;3;Older brothers and sisters often feel ignored when their parents only spend time with a new baby.
322;108;1;Aaron Burr challenged Alexander Hamilton to a duel.
323;108;2;No one bothered to challenge the prominent lawyer.
324;108;3;Trying to become a doctor was quite a challenge, Dick discovered.
325;109;1;The young boy wanted a miniature sports car for his birthday.
326;109;2;Instead of buying a massive dog, Teddy got a miniature poodle.
327;109;3;We were seeking a miniature model of the bulky chess set.
328;110;1;The college student knew that he needed more than a basic textbook as a source for his report.
329;110;2;The source of Buddy's trouble was boredom.
330;110;3;Professor Smith's speech was a valid source of information on chemistry
331;111;1;Because he was so small, Larry could not excel in sports.
332;111;2;At least Hannah had the security of knowing that she excelled in swimming.
333;111;3;Clarence Darrow wanted to become a prominent lawyer, but he felt that he must first excel in history.
334;112;1;When my sister wants to look feminine, she changes from dungarees into a dress.
335;112;2;Some men cannot resist staring when they see a woman who is especially feminine.
336;112;3;My brother is ashamed to cry at a sad movie because people might think he is behaving in a feminine manner.
337;113;1;Congressman Gingrich mounted the platform to make his speech.
338;113;2;The watchman mounted the tower to see if there were any people in the vicinity.
339;113;3;My sister couldn't mount the horse so they gave her a pony instead.
340;114;1;Steffi Graf was challenged to compete for the tennis title.
341;114;2;The runner was reluctant to compete in front of his parents for the first time.
342;114;3;When the amateur became a pro, he had to compete against better men.
