Id;VocabularyId;Ordinal;English
997;332;1;After the excessive rains stopped, the flood waters subsided.
998;332;2;The waves subsided when the winds ceased to blow.
999;332;3;Danny's anger subsided when the culprit apologized.
1000;333;1;Auto accidents maim many persons each year.
1001;333;2;Though he went through an awesome experience in the crash, Fred was not seriously maimed.
1002;333;3;Car manufacturers insist that seat belts can prevent the maiming of passengers in the event of a crash.
1003;334;1;If you can use a word correctly, there is a good chance that you comprehend it.
1004;334;2;You need not be a pauper to comprehend fully what hunger is.
1005;334;3;My parents say that they cannot comprehend today's music.
1006;335;1;Everyone commended the mayor's thrifty suggestion.
1007;335;2;Florence commended the baby to her aunt's care.
1008;335;3;The truth is that we all like to be commended for good work.
1009;336;1;The final week of the term is rapidly approaching.
1010;336;2;Jose was commended for his improvement in the final test.
1011;336;3;The final censor of our actions is our own conscience.
1012;337;1;Our school exempts bright pupils from final exams.
1013;337;2;School property is exempt from most taxes.
1014;337;3;Juvenile offenders are not exempt from punishment.
1015;338;1;Josephine is quite vain about her beauty.
1016;338;2;To be perfectly frank, I do not see what she has to be vain about.
1017;338;3;Brian made numerous vain attempts to reach the doctor by telephone.
1018;339;1;The repetition of new words in this book will help you to learn them.
1019;339;2;Any repetition of such unruly behavior will be punished.
1020;339;3;After a repetition of his costly mistake, Jerry was fired from his job.
1021;340;1;The artist and the author both tried to depict the sunset's beauty.
1022;340;2;Mr. Salinger depicted the juvenile character with great accuracy,
1023;340;3;The extent of the disaster can scarcely be depicted in words.
1024;341;1;We must live with the knowledge that all living creatures are mortal.
1025;341;2;His rash venture brought him to a mortal illness.
1026;341;3;The two monarchs were mortal enemies.
1027;342;1;The architect created a novel design which pleased everyone.
1028;342;2;The novel plan caused some unforeseen problems.
1029;342;3;Robert was commended by his teacher for the excellent report on the American novel, The Grapes of Wrath.
1030;343;1;A feeble old woman was the only occupant of the shack.
1031;343;2;The will disclosed that the occupant of the estate was penniless.
1032;343;3;The occupant of the car beckoned us to follow him.
1033;344;1;The library was appointed as the best place for the urgent meeting.
1034;344;2;Though Mr. Thompson was appointed to a high position, he did not neglect his old friends.
1035;344;3;The occupant of the well-appointed guest room considered himself quite fortunate.
1036;345;1;The large family was unaccustomed to such small quarters.
1037;345;2;Ellen moved to the French Quarter of our city.
1038;345;3;The city quartered the paupers in an old school.
1039;346;1;The agent insisted that the house had one of the best sites in town.
1040;346;2;We were informed by our guide that a monument would be built on the site of the historic battle.
1041;346;3;For the site of the new school, the committee preferred an urban location.
1042;347;1;She often quotes her spouse to prove a point.
1043;347;2;The stockbroker quoted gold at a dollar off yesterday's closing price.
1044;347;3;Biblical quotes offer a unique opportunity for study.
1045;348;1;"The verse from the Bible which my father quoted most frequently was, ""Love thy neighbor as thyself."""
1046;348;2;Several verses of a religious nature were contained in the document.
1047;348;3;Though it is not always easy to comprehend, Shakespeare's verse has merit that is worth the toil.
1048;349;1;The editor spoke on the morality of bugging the quarters of a political opponent.
1049;349;2;We rarely consider the morality of our daily actions ,though that should occupy a high position in our thinking.
1050;349;3;Kenny's unruly behavior has nothing to do with his lack of morality.
1051;350;1;In the days of the Wild West, outlaws roamed the country.
1052;350;2;A variety of animals once roamed our land.
1053;350;3;The bachelor promised his girlfriend that he would roam no more.
1054;351;1;The magnet attracted the iron particles.
1055;351;2;Adventure was the thrill which attracted the famous mountain climber to the jagged peak.
1056;351;3;A glimpse into the brightly colored room attracted the children's attention.
1057;352;1;The average commuter would welcome a chance to live in the vicinity of his or her work.
1058;352;2;Have your commuter's ticket verified by the conductor.
1059;352;3;A novel educational program gives college credit to commuters who listen to a lecture while they are traveling to work.
1060;353;1;The fugitive was caught and confined to jail for another two years.
1061;353;2;A virus that was circulating in the area confined AI to his house.
1062;353;3;Polio confined President Roosevelt to a wheelchair.
1063;354;1;Any attempt to study was abandoned by the student, who idled away the morning.
1064;354;2;The idle hours of a holiday frequently provide the best time to take stock.
1065;354;3;Do not deceive yourself into thinking that these are just idle rumors.
1066;355;1;This small metal idol illustrates the art of ancient Rome.
1067;355;2;John Wayne was the idol of many young people who liked cowboy movies.
1068;355;3;Scientists are still trying to identify this idol found in the ruins.
1069;356;1;Though he spoke in jest, Mark was undoubtedly giving us a message.
1070;356;2;Do not jest about matters of morality.
1071;356;3;In some quarters, honesty and hard work have become subjects of jest.
1072;357;1;It is patriotic to accept your responsibilities to your country.
1073;357;2;The patriotic attitude of the captive led him to refuse to cooperate with the enemy.
1074;357;3;"Nathan Hate's patriotic statement has often been quoted: ""I regret that I have but one life to give for my country."""
1075;358;1;The valor of the Vietnam veterans deserves the highest com me ndation.
1076;358;2;No one will dispute the valor of Washington's men at Valley Forge.
1077;358;3;The fireman's valor in rushing into the flaming house saved the occupants from a horrid fate.
1078;359;1;Only a lunatic would willingly descend into the monster's cave.
1079;359;2;Certain lunatic ideas persist even though they have been rejected by all logical minds.
1080;359;3;My roommate has some lunatic ideas about changing the world.
1081;360;1;A vein of lunacy seemed to run in the family.
1082;360;2;Mario's wrist was severely cut by the rock, causing his vein to bleed heavily.
1083;360;3;Explorations disclosed the rich vein of copper in the mountain.
1084;361;1;After the variety of bewildering experiences at the start of our trip, we were happy that the rest of the journey was 
1085;361;2;ventful.
1086;361;3;Our annual class outing proved quite uneventful.
1087;361;4;The meeting seemed uneventful but expert observers realized that important decisions were being made.
1088;362;1;Chicks hatch from fertile eggs.
1089;362;2;The loss of their fertile lands threw the farmers into a panic.
1090;362;3;A fertile mind need never be uneasy about finding life uneventful.
1091;363;1;Let us refer the dispute to the dean.
1092;363;2;Our teacher referred us to the dictionary for the meanings of the difficult words in the novel.
1093;363;3;The speaker referred to a verse in the Bible to support his theory.
1094;364;1;The family was in great distress over the accident that maimed Kenny.
1095;364;2;My teacher was distressed by the dismal performance of our class on the final examination.
1096;364;3;Long, unscheduled delays at the station cause distress to commuters.
1097;365;1;The excessive heat diminished as the sun went down.
1098;365;2;Our diminishing supply of food was carefully wrapped and placed with the baggage.
1099;365;3;The latest news from the battlefront confirms the report of diminishing military activity.
1100;366;1;Chris acknowledged that the maximum he had ever walked in one lesson was fifteen miles.
1101;366;2;We would like to exhibit this rare collection to the maximum number of visitors.
1102;366;3;The committee anticipated the maximum attendance of the first lesson of the performance.
1103;367;1;The fleeing outlaws were pursued by the police.
1104;367;2;One could clearly see the clouds fleeing before the wind.
1105;367;3;The majority of students understand that they cannot flee from their responsibilities.
1106;368;1;Achilles was vulnerable only in his heel.
1107;368;2;The investigator's nimble mind quickly located the vulnerable spot in the defendant's alibi.
1108;368;3;A vulnerable target for thieves is a solitary traveler.
1109;369;1;Oh! signifies surprise.
1110;369;2;A gift of such value signifies more than a casual relationship.
1111;369;3;"The word ""fragile"" stamped on a carton signifies that it must be handled with caution."
1112;370;1;The story of Proserpina and Ceres explaining the seasons is typical of Greek mythology.
1113;370;2;From a study of mythology we can conclude that the ancients were concerned with the wonders of nature.
1114;370;3;"Ancient mythology survives to this lesson in popular expressions such as ""Herculean task"" or ""Apollo Project""."
1115;371;1;The captain gave credit for the victory to his valiant colleagues.
1116;371;2;Who would have predicted that our pedestrian colleague would one lesson win the Nobel Prize for Medicine?
1117;371;3;We must rescue our colleagues from their wretched condition.
1118;372;1;Persistent headaches tormented him.
1119;372;2;The illustrations in our history text show the torments suffered by the victims of the French Revolution.
1120;372;3;The logical way to end the torment of doubt over the examination is to spend adequate time in study.
1121;373;1;The monarch referred to his knights' loyalty with pride.
1122;373;2;Nothing is so important to transmit to the youth as the sacredness of loyalty to one's country.
1123;373;3;Out of a sense of loyalty to his friends, Michael was willing to suffer torments, and he, therefore, refused to identify his 
1124;373;4;leagues in the plot.
1125;374;1;The draft has been abolished and replaced by a volunteer army.
1126;374;2;Terry did not hesitate to volunteer for the most difficult jobs.
1127;374;3;The boys were reluctant to volunteer their services to help clean up after the dance.
1128;375;1;Prejudice against minority groups will linger on as long as people ignore the facts.
1129;375;2;Eliminating prejudice should be among the first concerns of a democracy.
1130;375;3;The witness's weird behavior prejudiced Nancy's case.
1131;376;1;Despite their small size, crickets make very shrill noises.
1132;376;2;The shrill whistle of the policeman was warning enough for the fugitive to stop in his tracks.
1133;376;3;A shrill torrent of insults poured from the mouth of the shrieking woman.
1134;377;1;The jolly old man, an admitted bigamist, had forgotten to mention his first wife to his new spouse.
1135;377;2;When the jolly laughter subsided, the pirates began the serious business of dividing the gold.
1136;377;3;Are you aware that a red-suited gentleman with a jolly twinkle in his eyes is stuck in the chimney?
1137;378;1;Mr. Carlson's witty introduction qualifies him as a first-rate speaker.
1138;378;2;Fay is too slow to appreciate such witty remarks.
1139;378;3;The lawyer tried to prosecute the case by being witty and thereby entertaining the jury.
1140;379;1;Deep mud hindered travel in urban centers.
1141;379;2;The storm hindered the pursuit of the fleeing prisoners.
1142;379;3;Mona's gloomy nature hinders her relationships with other people.
1143;380;1;Rarely have I heard a lecture with such clear illustrations.
1144;380;2;Henry's father lectured him on the awesome perils of drug addiction.
1145;380;3;A famous journalist delivered a lecture on prejudice in the press.
1146;381;1;Those who abuse the privileges of the honor system will be penalized.
1147;381;2;The editor apologized for the abuse we had suffered as a result of his article.
1148;381;3;Brutal abuse of children in the orphanage was disclosed by the investigation.
1149;382;1;Ricky mumbled his awkward apology.
1150;382;2;This speech course will encourage you to stop mumbling and to speak more distinctly.
1151;382;3;When the witness continued to mumble, the judge asked him to speak up.
1152;383;1;The usually defiant child stood mute before the principal.
1153;383;2;People are no longer willing to remain mute on the subject of abuse of gun control.
1154;383;3;The horror of the famine left the inhabitants of the land mute with their tragic memories.
1155;384;1;To decrease the effects of the pressure, the diver put wads of cotton in his ears.
1156;384;2;The officer challenged George to explain the wad of fifty dollars which he had in his pocket.
1157;384;3;Because the automatic firing mechanism was defective, the hunter had to wad the powder into the gun by hand.
1158;385;1;Despite her lack of funds, Mrs. Reilly retained a detective to follow her spouse.
1159;385;2;China dishes have the unique quality of retaining heat longer than metal pans.
1160;385;3;Like the majority of people, I can retain the tune but not the words of a song.
1161;386;1;We can have a maximum of four candidates for the office of president.
1162;386;2;Each candidate for mayor seemed confident he would be victorious.
1163;386;3;The candidate took every precaution to avoid mentioning his opponent by name.
1164;387;1;Lyndon Johnson preceded Richard Nixon as President.
1165;387;2;In a gallant gesture, Ronnie allowed Amanda's name to precede his in the program listing.
1166;387;3;A prominent speaker preceded the ceremony of the granting of the diplomas.
1167;388;1;In his adolescent years, the candidate claimed, he had undergone many hardships.
1168;388;2;There is a fiction abroad that every adolescent is opposed to tradition.
1169;388;3;Our annual Rock Festival attracts thousands of adolescents.
1170;389;1;There has been a massive shift to coeducational schools.
1171;389;2;Coeducational institutions, once thought to have a disruptive effect, have been found to be beneficial.
1172;389;3;In choosing a college, Ned leans toward schools which are coeducational.
1173;390;1;The tendency to be vicious and cruel is a radical fault.
1174;390;2;We observe that the interest in radical views is beginning to subside.
1175;390;3;Because Richard was a radical, the Conservative Party would not accept him as a candidate.
1176;391;1;The vast crowd burst into spontaneous cheering at the skillful play.
1177;391;2;Be cautious with these oily rags because they can break out in spontaneous flame.
1178;391;3;William's spontaneous resentment at the mention of his sister was noted by the observant teacher.
1179;392;1;This soup will be more nourishing if you skim off the fat.
1180;392;2;I caught a glimpse of Mark and Marge skimming over the ice.
1181;392;3;Detective Corby, assigned to the homicide, was skimming through the victim's book of addresses.
1182;393;1;There has been a radical decline in polio since doctors began to vaccinate children with the Salk vaccine.
1183;393;2;The general population has accepted the need to vaccinate children against the once-dreaded disease.
1184;393;3;Numerous examples persist of people who have neglected to have their infants vaccinated.
1185;394;1;The bachelor's quarters were most untidy.
1186;394;2;We must start a clean-up campaign to keep the campus from being so untidy.
1187;394;3;Finding the house in such an untidy condition baffled us.
1188;395;1;Several utensils were untidily tossed about the kitchen.
1189;395;2;Edward's baggage contained all the utensils he would need on the camping trip.
1190;395;3;Some people are so old-fashioned that they reject the use of any modern utensil.
1191;396;1;The eye is sensitive to light.
1192;396;2;From the experiment we may conclude that mercury in a thermometer is sensitive to changes in temperature.
1193;396;3;James is sensitive about his wretched handwriting.
1194;397;1;The United States is mostly in the North Temperate Zone.
1195;397;2;All students received the appeal to be temperate and not to jump to conclusions in judging the new grading system.
1196;397;3;Mrs. Rollins commended her class for their temperate attitude when she announced the extra assignment.
1197;398;1;Joe's position was vague because he wanted to remain neutral in the dispute.
1198;398;2;When asked her opinion, Gladys was tactful enough to give a vague answer that did not hurt anyone.
1199;398;3;The vague shape in the distance proved to be nothing more weird than a group of trees.
1200;399;1;Private Carbo was elevated to higher rank for his valor.
1201;399;2;Reading a variety of good books elevates the mind.
1202;399;3;The candidate spoke from an elevated platform.
1203;400;1;The merit of a lottery is that everyone has an equal chance.
1204;400;2;We thought that a lottery was an absurd way of deciding who should be the team captain.
1205;400;3;The rash young man claimed the lottery prize only to find he had misread his number.
1206;401;1;The new employee boasted of his skill in finance.
1207;401;2;Frank circulated the rumor that his uncle would finance his way through college.
1208;401;3;Mrs. Giles retained a lawyer to handle her finances.
1209;402;1;An adolescent is finding it increasingly difficult to obtain a good job without a diploma.
1210;402;2;David obtained accurate information about college from his guidance counselor.
1211;402;3;Because this is a coeducational school, different rules obtain here.
1212;403;1;Censors have developed a rating system for the cinema.
1213;403;2;Today's cinema is full of homicides and violence.
1214;403;3;A best-seller is often the source of cinema stories.
1215;404;1;The greatest event in Ellie's life was winning the $50,000 lottery.
1216;404;2;We chose our seat carefully and then awaited the shot-put event.
1217;404;3;There is merit in gaining wisdom even after the event.
1218;405;1;Anna casually discarded one boyfriend after another.
1219;405;2;Confident that he held a winning hand, Slim refused to discard anything.
1220;405;3;Asked why he had discarded his family traditions, Mr. Menzel remained mute.
1221;406;1;We watched the soaring eagle skim over the mountain peak.
1222;406;2;An ordinary man cannot comprehend such soaring ambition.
1223;406;3;The senator's hopes for victory soared after his television appearance.
1224;407;1;Subsequent events proved that Sloan was right.
1225;407;2;Further explanations will be presented in subsequent lectures.
1226;407;3;Though the enemy forces resisted at first, they subsequently learned that their efforts were in vain.
1227;408;1;The traveler related his adventures with some exaggeration.
1228;408;2;After viewing the cinema's latest show, the observant student was able to relate every detail.
1229;408;3;Would you say that misfortune is related to carelessness?
1230;409;1;A factory engine is stationary.
1231;409;2;The population of our town has been stationary for a decade.
1232;409;3;Caught in the middle of traffic, the frightened pedestrian remained stationary in the busy street.
1233;410;1;Be prompt in assembling your baggage.
1234;410;2;Terry's caution prompted him to ask many questions before he consented.
1235;410;3;Larry was confident he knew his lines well enough not to need any prompting.
1236;411;1;A hasty glance convinced him that he was being followed.
1237;411;2;Rather than make a hasty decision, Mr. Torres rejected the offer.
1238;411;3;Myra apologized for the hasty visit.
1239;412;1;The hot iron scorched the tablecloth.
1240;412;2;Farmers reported that their wheat was being scorched by the fierce rays of the sun.
1241;412;3;Mr. Regan gave the class a scorching lecture on proper behavior in the cafeteria.
1242;413;1;The tempest drove the ship on the rocks.
1243;413;2;Following the weather report of the approaching tempest, we were prompted to seek immediate shelter.
1244;413;3;When Mr. Couche saw that a tempest was brewing over the issue, he hastily called a meeting.
1245;414;1;With an embrace, the mother soothed the hurt child.
1246;414;2;"Heat soothes some aches; cold soothes others."
1247;414;3;Rosalie's nerves were soothed by the soft music.
1248;415;1;Judge Cruz was sympathetic to the lawyer's plea for mercy.
1249;415;2;Father was fortunately sympathetic to my request to use the car on weekends.
1250;415;3;We were all sympathetic to Suzanne over her recent misfortune.
1251;416;1;The property on which money has been lent is redeemed when the loan is paid back.
1252;416;2;My family was relieved to hear that the mortgage had been redeemed.
1253;416;3;Mr. Franklin promptly redeemed his promise to help us in time of need.
1254;417;1;Resume reading where we left off.
1255;417;2;Those standing may resume their seats.
1256;417;3;The violinist resumed playing after the intermission.
1257;418;1;We hoped the incident would not disrupt the harmony that existed between the brothers.
1258;418;2;I am sympathetic to Warren because his plans are in harmony with mine.
1259;418;3;We responded to the harmony of the song by humming along.
1260;419;1;Refrain from making hasty promises.
1261;419;2;Milo could not refrain from laughing at the jest.
1262;419;3;If you want to be heard, you must refrain from mumbling.
1263;420;1;It is illegal to reveal the names of juvenile delinquents.
1264;420;2;Bigamy is illegal in the United States.
1265;420;3;Mr. Worthington's illegal stock manipulations led to his jail sentence.
1266;421;1;Opium is a powerful narcotic.
1267;421;2;We do not have adequate knowledge of the narcotic properties of these substances.
1268;421;3;The doctor prescribed a narcotic medicine to soothe the patient's suffering.
1269;422;1;Though Mr. Sloane is the heir to a gold mine, he lives like a miser.
1270;422;2;The monarch died before he could name an heir to the throne.
1271;422;3;It is essential that we locate the rightful heir at once.
1272;423;1;The lion is the most majestic creature of the jungle.
1273;423;2;In Greek mythology, Mt. Olympus was the majestic home of the gods.
1274;423;3;The graduates marched into the auditorium to the music of the majestic symphony.
1275;424;1;Our supply of unpolluted water has dwindled.
1276;424;2;With no visible signs of their ship, hopes for the men's safety dwindled with each passing hour.
1277;424;3;After the furious tempest, the dwindling chances of finding the raft vanished entirely.
1278;425;1;The patriot sneered when asked to stand on the same platform with the man who was accused of being a traitor.
1279;425;2;No villain is worse than a traitor who betrays his country.
1280;425;3;Do not call him a traitor unless you can verify the charge.
1281;426;1;Rico's excuse was a deliberate lie.
1282;426;2;My grandfather walks with deliberate steps.
1283;426;3;Judge Sirica deliberated for a week before making his decision known.
1284;427;1;Adolescent vandals wrecked the cafeteria.
1285;427;2;The vandals deliberately ripped the paintings from the wall.
1286;427;3;We could scarcely believe the damage caused by the vandals.
1287;428;1;Because of the drought, some farmers began to migrate to more fertile regions.
1288;428;2;In time of drought, the crops become scorched.
1289;428;3;As the drought wore on, people began to grumble against those who had squandered water when it was more plentiful.
1290;429;1;The team decided unanimously to abide by the captain's ruling.
1291;429;2;Senator Ervin abided by his promise not to allow demonstrations in the committee room.
1292;429;3;My mother cannot abide dirt and vermin.
1293;430;1;The novel traces the developments that unified the family.
1294;430;2;After the Civil War, our country became unified more strongly.
1295;430;3;It takes a great deal of training to unify all these recruits into an efficient fighting machine.
1296;431;1;We estimated the summit of the mountain to be twenty thousand feet.
1297;431;2;Do not underestimate Ruth's ambition to reach the summit of the acting profession.
1298;431;3;The summit meeting of world leaders diminished the threat of war.
1299;432;1;I demand that you heed what I say.
1300;432;2;Florence pays no heed to what the signs say.
1301;432;3;Take heed and be on guard against those who try to deceive you.
1302;433;1;Our teacher recommended the biography of the architect Frank L10yd Wright.
1303;433;2;The reading of a biography gives a knowledge of people and events that cannot always be obtained from history books.
1304;433;3;The biography of Malcolm X is a popular book in our school.
1305;434;1;A heavy rain drenched the campus, and the students had to dry out their wet clothing.
1306;434;2;The drenching rains resumed after only one lesson of sunshine.
1307;434;3;His fraternity friends tried to drench him but he was too clever for them.
1308;435;1;As darkness approached, the swarms of children playing in the park dwindled to a handful.
1309;435;2;The mosquitoes swarmed out of the swamp.
1310;435;3;Our campus swarmed with new students in September.
1311;436;1;Little Perry thrust his feet into the oversized shoes and wobbled over to the table.
1312;436;2;A baby wobbles when it begins to walk alone.
